A1: STUDENT MARKS Last Update: June 24th, 2006 4:00pm

A1: UNIT 1: WWI | B1: Unit 2 | C1: Essay | D1: Unit 3 | E1: Unit 4 | F1: Final
A2: Map: Map of Canada DM: Defining Moments Presentation SGA1: Small Group Acting U1T: Unit 1 Test Pos: WWI Poster/e-Portfolio U1: Unit 1 Updated Mark | B2: Pos: WWI Poster SLM: Student Learning Mod Quiz: 20/30 Quest U2: Unit 2 Mark M: Midterm Mark | C2: TS: Topic Selection Th: Thesis Out: Outline P: Finished Paper T: Total Essay Mark | D2: PE: People & Events VS: Vision Statement GVS: Group Vision Bo: Booth & Presentation HF: Heritage Fair Total WW2: WW2 Test U3: Unit 3 Mark | E2: GD: Great Debates SGA: Small Group Acting Web: 21st Century Website Update | F2: Term: Final Term Mark (70%) Oral: Trials of PM (15%) Exam: Written Exam (15%) Final: Final Mark in Course

D1: UNIT 1 | K1: UNIT 2 | R1: Essay | AB1: UNIT 3 | AN1: UNIT 4
D2: A | F2: TACK | K2: AC | AB2: Heritage Fair
D3: Map | E3: DM | F3: SGA1 | G3: U1T | I3: U1 | K3: Pos | L3: SLM | M3: Quiz | P3: U2 | R3: TS | S3: Th | T3: Out | U3: P | V3: T | X3: Essay | Z3: M | AB3: PE | AC3: VS | AD3: GVS | AE3: Bo | AF3: HF | AG3: HF | AH3: WW2 | AJ3: U3 | AL3: Update | AN3: GD | AO3: SGA | AP3: Web | AR3: Update | AT3: Term | AU3: Oral | AV3: Exam | AX3: Final
B4: Stu No | D4: 4 | E4: 16 | F4: 24 | G4: 42 | I4: 100 | K4: 10 | L4: 40 | M4: 30 | N4: =SUM(K4:M4) -> 80 | P4: 100 | R4: 10 | S4: 10 | T4: 20 | U4: 30 | V4: 70 | X4: 100 | Z4: 100 | AB4: 4 | AC4: 10 | AD4: 10 | AE4: 30 | AF4: =SUM(AC4:AE4) -> 50 | AG4: 100 | AH4: 100 | AJ4: 100 | AL4: 100 | AN4: 50 | AO4: 20 | AP4: 20 | AR4: 100 | AT4: 70 | AU4: 15 | AV4: 15 | AX4: 100
B6: 894 | D6: 4+ | E6: 14 | F6: 19 | G6: 33 | I6: 77 | K6: 7 | L6: 38 | M6: 20 | N6: =SUM(K6:M6) -> 65 | P6: 81 | R6: 9 | S6: 9 | T6: 17 | U6: 25 | V6: =SUM(R6:U6) -> 60 | X6: 86 | Z6: 81 | AB6: 4- | AC6: 9 | AD6: 6 | AE6: 26 | AF6: 41 | AG6: 82 | AH6: 90 | AJ6: 85 | AL6: 83 | AN6: 42 | AO6: 14 | AP6: 15 | AR6: 82 | AT6: 57 | AU6: 13 | AV6: 13 | AX6: =SUM(AT6:AW6) -> 83
B7: 9342 | D7: 3- | E7: 16 | F7: 20 | G7: 27 | I7: 74 | K7: 7 | L7: 36 | M7: 10 | N7: =SUM(K7:M7) -> 53 | P7: 66 | R7: 7 | S7: 7 | T7: 16 | U7: 23 | V7: =SUM(R7:U7) -> 53 | X7: 76 | Z7: 73 | AC7: 5 | AD7: 4 | AE7: 17 | AF7: =SUM(AC7:AE7) -> 26 | AG7: 52 | AH7: 45 | AJ7: 50 | AL7: 66 | AN7: 36 | AO7: 14 | AP7: 0 | AR7: 66 | AT7: 46 | AU7: 12 | AV7: 9 | AX7: =SUM(AT7:AW7) -> 67
B8: 5150 | D8: 4 | E8: 9 | F8: 18 | G8: 13 | I8: 51 | K8: 7 | L8: 28 | M8: 18 | N8: =SUM(K8:M8) -> 53 | P8: 66 | R8: 7 | S8: 4 | T8: 7 | U8: 17 | V8: =SUM(R8:U8) -> 35 | X8: 50 | Z8: 57 | AC8: 3 | AD8: 9 | AE8: 23 | AF8: =SUM(AC8:AE8) -> 35 | AG8: 70 | AH8: 25 | AJ8: 57 | AL8: 57 | AN8: 34 | AO8: 14 | AP8: 0 | AR8: 60 | AT8: 42 | AU8: 9 | AV8: 7 | AX8: =SUM(AT8:AW8) -> 58
B9: 4166 | D9: 4 | E9: 13 | F9: 19 | G9: 30 | I9: 77 | K9: 8 | L9: 30 | M9: 29 | N9: =SUM(K9:M9) -> 67 | P9: 83 | R9: 8 | S9: 8 | T9: 18 | U9: 24 | V9: =SUM(R9:U9) -> 58 | X9: 83 | Z9: 81 | AC9: 9 | AD9: 7 | AE9: 26 | AF9: 42 | AG9: 84 | AH9: 71 | AJ9: 77 | AL9: 80 | AN9: 36 | AO9: 14 | AP9: 0 | AR9: 78 | AT9: 55 | AU9: 11 | AV9: 12 | AX9: 78
B10: 3418 | D10: 3 | E10: 15 | F10: 22 | G10: 25 | I10: 76 | K10: 7 | L10: 31 | M10: 24 | N10: =SUM(K10:M10) -> 62 | P10: 78 | R10: 0 | S10: 7 | T10: 14 | U10: 17 | V10: =SUM(R10:U10) -> 38 | X10: 54 | Z10: 70 | AD10: 7 | AE10: 22 | AF10: 29 | AG10: 58 | AH10: 67 | AJ10: 63 | AL10: 68 | AN10: 39 | AO10: 14 | AP10: 14 | AR10: 70 | AT10: 49 | AU10: 11 | AV10: 9 | AX10: =SUM(AT10:AW10) -> 69
B11: 3504 | D11: 4 | E11: 14 | F11: 21 | G11: 40 | I11: 92 | K11: 9 | L11: 33 | M11: 23 | N11: =SUM(K11:M11) -> 65 | P11: 81 | R11: 8 | S11: 8 | T11: 18 | U11: 28 | V11: =SUM(R11:U11) -> 62 | X11: 89 | Z11: 88 | AB11: 3 | AC11: 9 | AD11: 9 | AE11: 26 | AF11: 44 | AG11: 88 | AH11: 88 | AJ11: 88 | AL11: 88 | AN11: 43 | AO11: 16 | AP11: 15 | AR11: 86 | AT11: 60 | AU11: 14 | AV11: 13 | AX11: =SUM(AT11:AW11) -> 87
B12: 1210 | D12: 3+ | E12: 12 | F12: 21 | G12: 33 | I12: 77 | K12: 9 | L12: 29 | M12: 25 | N12: =SUM(K12:M12) -> 63 | P12: 79 | R12: 8 | S12: 7 | T12: 15 | U12: 22 | V12: =SUM(R12:U12) -> 52 | X12: 75 | Z12: 78 | AB12: 2 | AC12: 2 | AD12: 8 | AE12: 22 | AF12: 32 | AG12: 64 | AH12: 52 | AJ12: 60 | AL12: 74 | AN12: 34 | AO12: 14 | AP12: 12 | AR12: 72 | AT12: 50 | AU12: 11 | AV12: 10 | AX12: =SUM(AT12:AW12) -> 71
B13: 3413 | D13: 4 | E13: 15 | F13: 21 | G13: 39 | I13: 92 | K13: 9 | L13: 39 | M13: 27 | N13: =SUM(K13:M13) -> 75 | P13: 94 | R13: 10 | S13: 10 | T13: 19 | U13: 28 | V13: =SUM(R13:U13) -> 67 | X13: 96 | Z13: 94 | AB13: 4+ | AC13: 9 | AD13: 9 | AE13: 27 | AF13: 45 | AG13: 90 | AH13: 86 | AJ13: 89 | AL13: 93 | AN13: 40 | AO13: 15 | AP13: 18 | AR13: 92 | AT13: 64 | AU13: 13 | AV13: 15 | AX13: =SUM(AT13:AW13) -> 92
B14: 3624 | D14: 4 | E14: 12 | F14: 22 | G14: 30 | I14: 80 | K14: 9 | L14: 30 | M14: 24 | N14: =SUM(K14:M14) -> 63 | P14: 79 | R14: 6 | S14: 8 | T14: 17 | U14: 25 | V14: =SUM(R14:U14) -> 56 | X14: 80 | Z14: 80 | AB14: 3 | AC14: 9 | AD14: 9 | AE14: 27 | AF14: 45 | AG14: 90 | AH14: 74 | AJ14: 84 | AL14: 82 | AN14: 40 | AO14: 15 | AP14: 19 | AR14: 82 | AT14: 57 | AU14: 11 | AV14: 13 | AX14: =SUM(AT14:AW14) -> 81
B16: 6587 | D16: 2 | E16: A | F16: 21 | G16: 22 | I16: 53 | K16: 7 | L16: 0 | M16: 14 | N16: =SUM(K16:M16) -> 21 | P16: 27 | R16: 0 | S16: 0 | T16: 0 | U16: 0 | V16: 0 | X16: 0 | Z16: 27 | AC16: 3 | AD16: 4 | AE16: 15 | AF16: 22 | AG16: 44 | AH16: 45 | AJ16: 45 | AL16: 35 | AN16: 35 | AO16: 13 | AP16: 0 | AR16: 35 | AT16: 25 | AU16: 11 | AV16: 11 | AX16: 51
B17: 9680 | D17: 3 | E17: 12 | F17: 22 | G17: 30 | I17: 78 | M17: A | R17: 7 | S17: 8 | T17: 0 | U17: 15 | V17: =SUM(R17:U17) -> 30 | X17: 45 | Z17: 65 | AB17: 3 | AC17: 4 | AD17: 8 | AE17: 20 | AF17: 32 | AG17: 64 | AH17: 72 | AJ17: 68 | AL17: 67 | AN17: 41 | AO17: 14 | AP17: 0 | AR17: 66 | AT17: 46 | AU17: 9 | AV17: 11 | AX17: =SUM(AT17:AW17) -> 66
B18: 8944 | D18: 4 | E18: 15 | F18: 21 | G18: 33 | I18: 85 | K18: 9 | L18: 38 | M18: 20 | N18: =SUM(K18:M18) -> 67 | P18: 83 | R18: 8 | S18: 9 | T18: 19 | U18: 26 | V18: =SUM(R18:U18) -> 62 | X18: 89 | Z18: 86 | AB18: 4 | AC18: 7 | AD18: 8 | AE18: 24 | AF18: 39 | AG18: 78 | AH18: 86 | AJ18: 82 | AL18: 85 | AN18: 37 | AO18: 15 | AP18: 18 | AR18: 84 | AT18: 59 | AU18: 11 | AV18: 11 | AX18: =SUM(AT18:AW18) -> 81
B19: 3462 | D19: 4 | E19: 16 | F19: 21 | G19: 34 | I19: 87 | K19: 8 | L19: 30 | M19: 27 | N19: =SUM(K19:M19) -> 65 | P19: 81 | R19: 8 | S19: 7 | T19: 16 | U19: 26 | V19: =SUM(R19:U19) -> 57 | X19: 81 | Z19: 83 | AB19: 3 | AC19: 7 | AD19: 6 | AE19: 21 | AF19: 34 | AG19: 68 | AH19: 70 | AJ19: 69 | AL19: 78 | AN19: 43 | AO19: 16 | AP19: Y | AR19: 82 | AT19: 57 | AU19: 12 | AV19: 13 | AX19: =SUM(AT19:AW19) -> 82
B20: 8341 | D20: 4 | E20: 12 | F20: 21 | G20: 33 | I20: 81 | K20: 8 | L20: 34 | M20: 20 | N20: =SUM(K20:M20) -> 62 | P20: 78 | R20: 9 | S20: 9 | T20: 16 | U20: 23 | V20: =SUM(R20:U20) -> 57 | X20: 81 | Z20: 80 | AB20: 4 | AC20: 8 | AD20: 9 | AE20: 24 | AF20: 41 | AG20: 82 | AH20: 66 | AJ20: 77 | AL20: 80 | AN20: 47 | AO20: 19 | AP20: Y | AR20: 84 | AT20: 59 | AU20: 12 | AV20: 11 | AX20: =SUM(AT20:AW20) -> 82
B21: 4165 | E21: 11 | F21: 20 | G21: 30 | I21: 71 | K21: 9 | L21: 24 | M21: 25 | N21: =SUM(K21:M21) -> 58 | P21: 73 | R21: 9 | S21: 0 | T21: 0 | U21: 16 | V21: =SUM(R21:U21) -> 25 | X21: 36 | Z21: 62 | AC21: 3 | AD21: 4 | AE21: 16 | AF21: 23 | AG21: 46 | AH21: 64 | AJ21: 58 | AL21: 61 | AN21: 36 | AO21: 14 | AP21: 17 | AR21: 64 | AT21: 45 | AU21: 12 | AV21: 12 | AX21: 70
B22: 6322 | E22: N | F22: 17 | G22: 10 | I22: 45 | K22: 0 | L22: 0 | M22: 7 | N22: =SUM(K22:M22) -> 7 | P22: 15 | R22: 0 | S22: 0 | T22: 0 | U22: 0 | V22: =SUM(R22:U22) -> 0 | X22: 40 | Z22: 36 | AD22: 4 | AE22: 15 | AF22: 19 | AG22: 38 | AH22: 25 | AJ22: 35 | AL22: 35 | AN22: A | AO22: A | AP22: 0 | AR22: 35 | AT22: 25 | AU22: X | AV22: 3 | AX22: 35
B23: 114 | D23: 4 | E23: 15 | F23: 22 | G23: 40 | I23: 94 | K23: 7 | L23: 37 | M23: 29 | N23: =SUM(K23:M23) -> 73 | P23: 91 | R23: 9 | S23: 7 | T23: 19 | U23: 26 | V23: =SUM(R23:U23) -> 61 | X23: 88 | Z23: 90 | AB23: 4 | AC23: 8 | AD23: 6 | AE23: 26 | AF23: 40 | AG23: 80 | AH23: 94 | AJ23: 87 | AL23: 90 | AN23: 42 | AO23: 14 | AP23: 19 | AR23: 88 | AT23: 62 | AU23: 13 | AV23: 14 | AX23: =SUM(AT23:AW23) -> 89
B25: 3454 | D25: 4 | E25: 14 | F25: 19 | G25: 35 | I25: 84 | K25: 8 | L25: 35 | M25: 27 | N25: =SUM(K25:M25) -> 70 | P25: 88 | R25: 9 | S25: 7 | T25: 17 | U25: 22 | V25: =SUM(R25:U25) -> 55 | X25: 79 | Z25: 84 | AB25: 3 | AC25: 6 | AD25: 9 | AE25: 26 | AF25: 41 | AG25: 82 | AH25: 75 | AJ25: 80 | AL25: 82 | AN25: 41 | AO25: 15 | AP25: 15 | AR25: 82 | AT25: 57 | AU25: 12 | AV25: 12 | AX25: =SUM(AT25:AW25) -> 81
B26: 2168 | D26: 4 | E26: 14 | F26: 18 | G26: 31 | I26: 78 | K26: 9 | L26: 27 | M26: 19 | N26: =SUM(K26:M26) -> 55 | P26: 70 | R26: 7 | S26: 7 | T26: 14 | U26: 17 | V26: =SUM(R26:U26) -> 45 | X26: 65 | Z26: 74 | AB26: 3 | AC26: 7 | AD26: 8 | AE26: 23 | AF26: 38 | AG26: 76 | AH26: 60 | AJ26: 72 | AL26: 73 | AN26: 34 | AO26: 15 | AP26: 0 | AR26: 70 | AT26: 49 | AU26: 9 | AV26: 9 | AX26: =SUM(AT26:AW26) -> 67
B27: 9157 | E27: 15 | F27: 21 | G27: 37 | I27: 85 | K27: 10 | L27: 35 | M27: 25 | N27: =SUM(K27:M27) -> 70 | P27: 88 | R27: 8 | S27: 9 | T27: 18 | U27: 24 | V27: =SUM(R27:U27) -> 59 | X27: 84 | Z27: 86 | AB27: 4 | AC27: 9 | AD27: 9 | AE27: 27 | AF27: 45 | AG27: 90 | AH27: 82 | AJ27: 87 | AL27: 87 | AN27: 46 | AO27: 20 | AP27: 19 | AR27: 90 | AT27: 63 | AU27: 15 | AV27: 13 | AX27: =SUM(AT27:AW27) -> 91
B28: 3546 | D28: 4- | E28: 15 | F28: 19 | G28: 34 | I28: 80 | K28: 7 | L28: 31 | M28: 19 | N28: =SUM(K28:M28) -> 57 | P28: 72 | R28: 8 | S28: 7 | T28: 14 | U28: 19 | V28: =SUM(R28:U28) -> 48 | X28: 69 | Z28: 74 | AB28: 4 | AC28: 7 | AD28: 8 | AE28: 22 | AF28: 37 | AG28: 74 | AH28: 65 | AJ28: 72 | AL28: 73 | AN28: 37 | AO28: 15 | AP28: 15 | AR28: 74 | AT28: 52 | AU28: 12 | AV28: 11 | AX28: =SUM(AT28:AW28) -> 75
B29: 9108 | D29: 4 | E29: 15 | F29: 19 | G29: 40 | I29: 91 | K29: 10 | L29: 32 | M29: 22 | N29: 64 | P29: 80 | R29: 7 | S29: 7 | T29: 14 | U29: 21 | V29: =SUM(R29:U29) -> 49 | X29: 70 | Z29: 82 | AB29: 3+ | AC29: 6 | AD29: 7 | AE29: 22 | AF29: 35 | AG29: 70 | AH29: 85 | AJ29: 76 | AL29: 80 | AN29: 39 | AO29: 15 | AP29: 15 | AR29: 80 | AT29: 56 | AU29: 11 | AV29: 12 | AX29: =SUM(AT29:AW29) -> 79
B30: 4499 | E30: 16 | F30: 19 | G30: 38 | I30: 85 | K30: 8 | L30: 34 | M30: 21 | N30: =SUM(K30:M30) -> 63 | P30: 80 | R30: 7 | S30: 9 | T30: 13 | U30: 22 | V30: =SUM(R30:U30) -> 51 | X30: 73 | Z30: 80 | AB30: 4 | AC30: 7 | AD30: 7 | AE30: 24 | AF30: 38 | AG30: 76 | AH30: 80 | AJ30: 78 | AL30: 80 | AN30: 41 | AO30: 15 | AP30: 14 | AR30: 80 | AT30: 56 | AU30: 12 | AV30: 11 | AX30: =SUM(AT30:AW30) -> 79
B31: 3049 | D31: 4 | E31: 11 | F31: 19 | G31: 42 | I31: 88 | K31: 8 | L31: 33 | M31: 27 | N31: =SUM(K31:M31) -> 68 | P31: 85 | R31: 10 | S31: 9 | T31: 18 | U31: 23 | V31: =SUM(R31:U31) -> 60 | X31: 86 | Z31: 86 | AB31: 4 | AC31: 9 | AD31: 6 | AE31: 25 | AF31: 40 | AG31: 80 | AH31: 78 | AJ31: 80 | AL31: 84 | AN31: 42 | AO31: 17 | AP31: 17 | AR31: 84 | AT31: 59 | AU31: 12 | AV31: 14 | AX31: =SUM(AT31:AW31) -> 85
B32: 3728 | D32: 4 | E32: 11 | F32: A | G32: 23 | I32: 62 | K32: 9 | L32: 28 | M32: 20 | N32: =SUM(K32:M32) -> 57 | P32: 72 | R32: 9 | S32: 9 | T32: 18 | U32: 22 | V32: =SUM(R32:U32) -> 58 | X32: 83 | Z32: 73 | AB32: 3 | AC32: 7 | AD32: 9 | AE32: 23 | AF32: 39 | AG32: 78 | AH32: 70 | AJ32: 75 | AL32: 74 | AN32: 40 | AO32: 16 | AP32: 16 | AR32: 76 | AT32: 53 | AU32: 12 | AV32: 10 | AX32: =SUM(AT32:AW32) -> 75
B34: 2857 | D34: 4 | E34: 16 | F34: 21 | G34: 32 | I34: 85 | K34: 9 | L34: 31 | M34: 26 | N34: =SUM(K34:M34) -> 66 | P34: 83 | R34: 8 | S34: 9 | T34: 18 | U34: 21 | V34: =SUM(R34:U34) -> 56 | X34: 80 | Z34: 83 | AB34: 4 | AC34: 10 | AD34: 9 | AE34: 28 | AF34: 47 | AG34: 94 | AH34: 76 | AJ34: 90 | AL34: 85 | AN34: 41 | AO34: 15 | AP34: 18 | AR34: 85 | AT34: 60 | AU34: 12 | AV34: 13 | AX34: =SUM(AT34:AW34) -> 85
B35: 9366 | D35: 4 | E35: 14 | F35: 19 | G35: 29 | I35: 77 | K35: 9 | L35: 34 | M35: 24 | N35: =SUM(K35:M35) -> 67 | P35: 83 | R35: 10 | S35: 8 | T35: 16 | U35: 24 | V35: =SUM(R35:U35) -> 58 | X35: 83 | Z35: 82 | AB35: 3 | AC35: 9 | AD35: 9 | AE35: 27 | AF35: 45 | AG35: 90 | AH35: 70 | AJ35: 83 | AL35: 82 | AN35: 40 | AO35: 15 | AP35: 19 | AR35: 82 | AT35: 57 | AU35: 10 | AV35: 13 | AX35: =SUM(AT35:AW35) -> 80
B36: 2703 | D36: 3 | E36: 14 | F36: 19 | G36: 38 | I36: 86 | K36: 7 | L36: 29 | M36: 24 | N36: =SUM(K36:M36) -> 60 | P36: 75 | R36: 8 | S36: 6 | T36: 16 | U36: 23 | V36: =SUM(R36:U36) -> 53 | X36: 76 | Z36: 80 | AB36: 3 | AC36: 7 | AD36: 8 | AE36: 22 | AF36: 37 | AG36: 74 | AH36: 86 | AJ36: 80 | AL36: 80 | AN36: 39 | AO36: 14 | AP36: 17 | AR36: 80 | AT36: 56 | AU36: 11 | AV36: 13 | AX36: =SUM(AT36:AW36) -> 80
B37: 5267 | D37: 3- | E37: 12 | F37: 19 | G37: 36 | I37: 78 | K37: 9 | L37: 33 | M37: 20 | N37: =SUM(K37:M37) -> 62 | P37: 78 | R37: 8 | S37: 8 | T37: 14 | U37: 21 | V37: =SUM(R37:U37) -> 51 | X37: 73 | Z37: 76 | AB37: 4 | AC37: 7 | AD37: 8 | AE37: 22 | AF37: 37 | AG37: 74 | AH37: 78 | AJ37: 76 | AL37: 76 | AN37: 43 | AO37: 16 | AP37: 18 | AR37: 79 | AT37: 55 | AU37: 12 | AV37: 12 | AX37: =SUM(AT37:AW37) -> 79
B38: 4639 | D38: 3 | E38: 16 | F38: 21 | G38: 38 | I38: 90 | K38: 9 | L38: 34 | M38: 27 | N38: =SUM(K38:M38) -> 70 | P38: 88 | R38: 7 | S38: 8 | T38: 16 | U38: 26 | V38: =SUM(R38:U38) -> 57 | X38: 81 | Z38: 86 | AB38: 4 | AC38: 8 | AD38: 9 | AE38: 24 | AF38: 41 | AG38: 82 | AH38: 72 | AJ38: 77 | AL38: 84 | AN38: 40 | AO38: 15 | AP38: 15 | AR38: 82 | AT38: 57 | AU38: 12 | AV38: 13 | AX38: =SUM(AT38:AW38) -> 82
B39: 2588 | D39: 4+ | E39: 15 | F39: 21 | G39: 36 | I39: 84 | K39: 7 | L39: 39 | M39: 25 | N39: =SUM(K39:M39) -> 71 | P39: 90 | R39: 9 | S39: 9 | T39: 19 | U39: 22 | V39: =SUM(R39:U39) -> 59 | X39: 84 | Z39: 86 | AB39: 3 | AC39: 9 | AD39: 9 | AE39: 28 | AF39: 46 | AG39: 92 | AH39: 80 | AJ39: 87 | AL39: 87 | AN39: 45 | AO39: 17 | AP39: 20 | AR39: 90 | AT39: 63 | AU39: 12 | AV39: 12 | AX39: =SUM(AT39:AW39) -> 87
I41: 76 | Z41: 76 | AR41: 76 | AX41: 76